{"$schema":"https://json-schema.org/draft/2020-12/schema","$id":"https://shockbridge-pulse.example/helix/contracts/generation.schema.json","title":"Evidence-Bound Assistance","type":"object","additionalProperties":false,"required":["request_id","decision","answer","citations","intent","queue","confidence","unsupported_claims","requires_human_review","escalation_reason","model_version","prompt_version","corpus_version"],"properties":{"request_id":{"type":"string","format":"uuid"},"decision":{"enum":["ANSWER_WITH_EVIDENCE","AUTO_ROUTE","RECOMMEND_TO_AGENT","ASK_FOR_CLARIFICATION","ESCALATE_LOW_CONFIDENCE","ESCALATE_OUT_OF_SCOPE","ESCALATE_CONFLICTING_EVIDENCE","ESCALATE_SAFETY_RISK","ESCALATE_SYSTEM_FAILURE"]},"answer":{"type":"string","maxLength":8000},"citations":{"type":"array","uniqueItems":true,"items":{"type":"string","minLength":1}},"intent":{"type":["string","null"]},"queue":{"type":["string","null"]},"confidence":{"type":"number","minimum":0,"maximum":1},"unsupported_claims":{"type":"array","items":{"type":"string"}},"requires_human_review":{"type":"boolean"},"escalation_reason":{"type":["string","null"]},"model_version":{"type":"string","minLength":1},"prompt_version":{"type":"string","minLength":1},"corpus_version":{"type":"string","minLength":1}}}
